<?xml version="1.0" encoding="UTF-8"?>

<!--
  Empty CV with name and companies filled out.
-->
<resume-content
  xmlns="https://github.com/b-vennes/presume"
  xmlns:xsi="http://www.w3.org/2001/XMLSchema-instance"
  xsi:schemaLocation="https://github.com/b-vennes/presume cv-schema.xsd"
>

  <header
    name="Branden Vennes"
    email="b.n.vennes@gmail.com"
    github="b-vennes"
  >
    <summary>
      Software engineer with six years of experience building full-stack and platform applications and services.  Passionate about building high-quality software with rigorous testing, build, and deployment strategies to always ensure high-availability.  Expert with developing in Scala, C#, TypeScript, and Python.
    </summary>
  </header>

  <experience
    business="The Walt Disney Company"
    title="Software Engineer II"
  >
    <start-date year="2022" month="6" />
    <end-date year="2025" month="8" />

    <detail>
      Developed a suite of tools for integrating with AWS Kinesis streams using stongly-typed data schemas
    </detail>
    <detail>
      Constructed build pipelines with Scala, Java, and Python code generation
    </detail>
    <detail>
    </detail>
  </experience>

  <experience
    business="Topl"
    title="Blockchain Platform Engineer"
  >
    <start-date year="2021" month="3" />
    <end-date year="2022" month="5" />
    <detail>
      <!-- TODO -->
    </detail>
  </experience>

  <experience
    business="Viewpoint Construction Software"
    title="Software Engineer I &amp; II"
  >
    <start-date year="2019" month="9" />
    <end-date year="2021" month="4" />
    <detail>
      <!-- TODO -->
    </detail>
  </experience>

  <experience
    business="Viewpoint Construction Software"
    title="QA Automation Engineer"
  >
    <start-date year="2018" month="8" />
    <end-date year="2019" month="8" />
    <detail>
      <!-- TODO -->
    </detail>
  </experience>

  <education
    school="University of Portland"
    degree="Bachelors of Science"
  >
    <start-date year="2015" month="8" />
    <end-date year="2019" month="5" />
    <detail>Computer Science Major</detail>
    <detail>Mathematics Minor</detail>
  </education>

  <certification name="AWS Cloud Practitioner"/>

  <skills group="TODO">
    <skill><!-- TODO --></skill>
  </skills>

</resume-content>
