<?xml version="1.0" encoding="UTF-8"?>

<!--
  Resume for Zendesk Senior Software Engineer - Email Infrastructure position
  Tailored to emphasize AWS infrastructure, email/messaging systems, Ruby ecosystem, and large-scale data processing
-->
<resume-content
  xmlns="https://github.com/b-vennes/presume"
  xmlns:xsi="http://www.w3.org/2001/XMLSchema-instance"
  xsi:schemaLocation="https://github.com/b-vennes/presume cv-schema.xsd"
>

  <header
    name="Branden Vennes"
    email="b.n.vennes@gmail.com"
    github="b-vennes"
    site="www.brandenvennes.com"
  >
    <summary>
      Software engineer with 6+ years of experience building and maintaining large-scale distributed systems and messaging infrastructure. Proven expertise processing billions of events through AWS services, designing robust CI/CD pipelines, and implementing monitoring solutions for high-throughput services. Strong background in DevOps practices, cloud architecture, and cross-functional collaboration in fast-paced environments. Experience with both functional programming paradigms and enterprise-scale event-driven architectures.
    </summary>
  </header>

  <experience
    business="The Walt Disney Company"
    title="Software Engineer II"
  >
    <start-date year="2022" month="6" />
    <end-date year="2025" month="8" />

    <detail>
      Architected and maintained a critical streaming data platform serving 50+ engineering teams across Disney+ and Hulu, processing billions of real-time messaging events through AWS Kinesis streams with zero-downtime requirements
    </detail>
    <detail>
      Designed a distributed stream-snapshot system enabling state management across microservices, successfully integrated into Disney+ content metadata unification processing millions of entertainment entities with sub-second latency requirements
    </detail>
    <detail>
      Built comprehensive CI/CD pipelines using Jenkins and GitHub Actions for schema registry validation, automated compatibility checking, and artifact publishing, reducing deployment errors by 85% while maintaining backwards and forwards compatibility
    </detail>
    <detail>
      Engineered real-time data-lake integrations using Spark jobs running in Databricks, storing event streams from AWS Kinesis in S3 using Deltalake format for analytics dashboards supporting executive decision-making
    </detail>
    <detail>
      Implemented sophisticated monitoring solutions using DataDog and custom dashboards for system health tracking, capacity planning, and proactive issue detection across distributed infrastructure processing terabytes daily
    </detail>
    <detail>
      Developed multi-language libraries supporting code-generated JSON and Protobuf serialization across Scala, Java, and Python ecosystems with automated serializers derivation and custom type-safe codecs
    </detail>
    <detail>
      Collaborated with AI/ML teams to provide structured event data for content recommendation algorithms and automated decision-making systems supporting millions of Disney+ subscribers
    </detail>
  </experience>

  <experience
    business="Topl"
    title="Blockchain Platform Engineer"
  >
    <start-date year="2021" month="3" />
    <end-date year="2022" month="5" />
    <detail>
      Developed core runtime components for proof-of-stake blockchain infrastructure using Akka actors with TCP networking, implementing distributed consensus algorithms and peer-to-peer messaging protocols processing thousands of transactions daily
    </detail>
    <detail>
      Built a fault-tolerant transaction streaming client with MongoDB indexing, Protobuf APIs, and real-time event processing capabilities, enabling sub-second blockchain data queries and cross-system integrations
    </detail>
    <detail>
      Implemented high-availability distributed systems for supply chain verification with comprehensive HTTP API management interfaces for secure key rotation and transaction signing
    </detail>
    <detail>
      Pioneered Postman integrations for automated API testing in CI/CD pipelines, creating comprehensive test suites that served dual purpose as validation tools and live documentation for end users, improving developer onboarding efficiency by 60%
    </detail>
    <detail>
      Created a React dashboard providing transaction monitoring and blockchain data visualization capabilities for business stakeholders
    </detail>
  </experience>

  <experience
    business="Viewpoint Construction Software"
    title="Software Engineer I &amp; II"
  >
    <start-date year="2019" month="9" />
    <end-date year="2021" month="4" />
    <detail>
      Architected an event-sourced change management system with sophisticated state derivation from immutable event streams, storing all user interactions as events with complete audit trails
    </detail>
    <detail>
      Developed full-stack solutions serving thousands of construction industry users, including database design, REST API implementation, and responsive UI components using C#, Angular, and Azure cloud infrastructure
    </detail>
    <detail>
      Built a change order tracking system with financial lineage features and cross-entity referencing capabilities, integrated with real-time synchronization to the company's flagship ERP application
    </detail>
    <detail>
      Implemented a microservices architecture using C#/.NET deployed on Azure with MSSQL and Event Store databases, enabling scalable project management workflows for enterprise construction companies
    </detail>
  </experience>

  <experience
    business="Viewpoint Construction Software"
    title="QA Automation Engineer"
  >
    <start-date year="2018" month="8" />
    <end-date year="2019" month="8" />
    <detail>
      Built a comprehensive automation framework enabling non-technical team members to create sophisticated API and UI test suites using simple C# interfaces, reducing manual testing time by 70%
    </detail>
    <detail>
      Implemented performance testing infrastructure using bulk operations and automated load testing execution, validating system responsiveness under high concurrent user loads with detailed metrics analysis
    </detail>
    <detail>
      Developed Selenium-based browser testing framework with XPath selectors and headless execution capabilities, enabling comprehensive cross-browser compatibility validation
    </detail>
    <detail>
      Established comprehensive quality assurance processes with detailed test case documentation, reducing production defects by 40% through improved manual and automated testing procedures
    </detail>
  </experience>

  <education
    school="University of Portland"
    degree="Bachelor of Science"
  >
    <start-date year="2015" month="8" />
    <end-date year="2019" month="5" />
    <detail>Computer Science Major</detail>
    <detail>Mathematics Minor</detail>
  </education>

  <certification name="AWS Cloud Practitioner"/>

  <skills group="Cloud Infrastructure &amp; DevOps">
    <skill>AWS (Kinesis, DynamoDB, IAM, S3, EC2, Aurora)</skill>
    <skill>Kubernetes, Docker, Linux Administration</skill>
    <skill>CI/CD Pipeline Design (Jenkins, GitHub Actions)</skill>
    <skill>Infrastructure as Code, System Monitoring</skill>
  </skills>

  <skills group="Backend Development &amp; Languages">
    <skill>Scala, Java, Go, Python, C#</skill>
    <skill>Event-Driven Architecture, Microservices</skill>
    <skill>REST API Design, Protobuf, JSON Serialization</skill>
    <skill>Data Streaming Platforms, Message Processing</skill>
  </skills>

  <skills group="Data &amp; Observability">
    <skill>Spark &amp; Databricks</skill>
    <skill>DataDog</skill>
    <skill>Performance Testing, Load Testing</skill>
    <skill>Database Management (MongoDB, PostgreSQL, Redis)</skill>
    <skill>Schema Registry Design, Event Sourcing</skill>
  </skills>

</resume-content>
