<?xml version="1.0" encoding="UTF-8"?>

<!--
  Resume for Upside Senior Software Engineer I position
-->
<resume-content
  xmlns="https://github.com/b-vennes/presume"
  xmlns:xsi="http://www.w3.org/2001/XMLSchema-instance"
  xsi:schemaLocation="https://github.com/b-vennes/presume cv-schema.xsd"
>

  <header
    name="Branden Vennes"
    email="b.n.vennes@gmail.com"
    github="b-vennes"
  >
    <summary>
      Senior software engineer with 6+ years of experience in building scalable data platforms, event-driven systems, and schema management solutions. Proven track record in designing streaming architectures, implementing data workflows with modern tools, and driving quality through documentation and best practices. Passionate about enhancing development velocity with the right tools and building resilient systems that empower data producers and consumers.
    </summary>
  </header>

  <experience
    business="The Walt Disney Company"
    title="Software Engineer II"
  >
    <start-date year="2022" month="6" />
    <end-date year="2025" month="8" />

    <detail>Built and maintained a streaming data platform serving dozens of teams across Disney+ and Hulu with schema registry and data publishing capabilities</detail>
    <detail>Architected a stream-snapshot system enabling teams to maintain state from event streams, integrated into a content metadata unification project processing millions of entertainment entities</detail>
    <detail>Designed complex validation pipelines using Jenkins and Github Actions to ensure schema compatibility and prevent runtime errors across production systems</detail>
    <detail>Implemented multi-language code generation supporting Scala, Java, and Python with automatic semantic versioning and artifact publishing</detail>
    <detail>Migrated teams from OpenAPI to AWS Smithy schemas, improving data payload definition accuracy and tooling integration</detail>
    <detail>Developed comprehensive testing frameworks using Scalacheck integration and provided serialization libraries for JSON and Protobuf formats</detail>
    <detail>Built data pipelines for the enterprise data-lake maintained in Databricks, processing streaming data for analytics, machine learning workflows, and executive decision-making</detail>
  </experience>

  <experience
    business="Topl"
    title="Blockchain Platform Engineer"
  >
    <start-date year="2021" month="3" />
    <end-date year="2022" month="5" />
    <detail>
      Developed a proof-of-stake blockchain platform using Scala and Akka actors with TCP networking for supply chain verification
    </detail>
    <detail>Built an HTTP management API enabling secure key rotation and transaction signing for blockchain nodes</detail>
    <detail>Created a transaction streaming client using http4s and Cats Effect with MongoDB indexing and Protobuf API for real-time block queries</detail>
    <detail>Designed a React user-interface providing easy blockchain data querying for end users</detail>
  </experience>

  <experience
    business="Viewpoint Construction Software"
    title="Software Engineer I &amp; II"
  >
    <start-date year="2019" month="9" />
    <end-date year="2021" month="4" />
    <detail>Developed full-stack features for a construction project management platform using C# microservices, MSSQL databases, and Azure deployments</detail>
    <detail>Architected an event-sourced change management system storing user interactions as events with derived application state</detail>
    <detail>Implemented sophisticated change order tracking with cross-entity references and enterprise resource management integration</detail>
    <detail>Built API improvements and UI enhancements across the technology stack for submittals, RFIs, and issue tracking, providing construction teams the tools needed to manage complex projects</detail>
    <detail>Collaborated with cross-functional teams to deliver integrated solutions connecting the web application with the flagship enterprise software</detail>
  </experience>

  <experience
    business="Viewpoint Construction Software"
    title="QA Automation Engineer"
  >
    <start-date year="2018" month="8" />
    <end-date year="2019" month="8" />
    <detail>Developed an automated testing framework enabling non-technical QA team members to define test cases using simple C# interfaces</detail>
    <detail>Built an API testing framework executing backend microservice workflow tests and a UI framework using Selenium with X-Path navigation</detail>
    <detail>Executed performance testing including bulk operations and load testing to ensure application responsiveness under scale</detail>
    <detail>Created and maintained comprehensive test case documentation for manual and automated testing procedures</detail>
  </experience>

  <education
    school="University of Portland"
    degree="Bachelors of Science"
  >
    <start-date year="2015" month="8" />
    <end-date year="2019" month="5" />
    <detail>Computer Science Major</detail>
    <detail>Mathematics Minor</detail>
  </education>

  <certification name="AWS Cloud Practitioner"/>

  <skills group="Programming Languages &amp; Frameworks">
    <skill>Scala</skill>
    <skill>Java</skill>
    <skill>Python</skill>
    <skill>Kotlin</skill>
    <skill>C#</skill>
    <skill>JavaScript</skill>
    <skill>SQL</skill>
  </skills>

  <skills group="Data &amp; Cloud Technologies">
    <skill>AWS (Kinesis, DynamoDB, Lambda, S3)</skill>
    <skill>PostgreSQL</skill>
    <skill>Event Sourcing</skill>
    <skill>Schema Registry</skill>
    <skill>Protobuf</skill>
    <skill>MongoDB</skill>
    <skill>MSSql</skill>
    <skill>Databricks</skill>
  </skills>

  <skills group="Development &amp; Operations">
    <skill>GitHub Actions</skill>
    <skill>Jenkins</skill>
    <skill>Docker</skill>
    <skill>Microservices Architecture</skill>
    <skill>Test Automation</skill>
    <skill>Performance Testing</skill>
    <skill>System Design</skill>
  </skills>

</resume-content>
