<?xml version="1.0" encoding="UTF-8"?>

<!--
  CV tailored for UiPath Senior Software Engineer II position
-->
<resume-content
  xmlns="https://github.com/b-vennes/presume"
  xmlns:xsi="http://www.w3.org/2001/XMLSchema-instance"
  xsi:schemaLocation="https://github.com/b-vennes/presume cv-schema.xsd"
>

  <header
    name="Branden Vennes"
    email="b.n.vennes@gmail.com"
    github="b-vennes"
  >
    <summary>
      Experienced fullstack software engineer with 6+ years developing scalable, distributed systems and component libraries. Proven track record building high-impact products serving millions of users, with expertise in modern frameworks, microservices architecture, and cloud platforms. Strong background in schema registries, API development, and cross-team collaboration in fast-paced environments.
    </summary>
  </header>

  <experience
    business="The Walt Disney Company"
    title="Software Engineer II"
  >
    <start-date year="2022" month="6" />

    <detail>
      Software engineer on streaming data platform team enabling cross-team data sharing through schema registry and real-time data streaming infrastructure supporting millions of users worldwide.
    </detail>
    <detail>
      Architected and developed foundational component libraries and frameworks for real-time data streaming, enabling teams to publish/subscribe to event streams with high reliability and performance.
    </detail>
    <detail>
      Built a stream snapshot system allowing teams to maintain stateful applications from event streams, including integration with a unified content metadata system for cataloging media content across multiple platforms.
    </detail>
    <detail>
      Designed and implemented an enterprise schema registry using version-controlled repositories with OpenAPI and AWS Smithy schemas, including complex validation pipelines ensuring backward compatibility across distributed applications.
    </detail>
    <detail>
      Developed a multi-language artifact publishing system supporting Scala, Java, Python, and Protobuf with JSON serialization libraries, functional programming integration, and automated testing frameworks.
    </detail>
    <detail>
      Collaborated on enterprise data lake solutions using modern columnar formats and cloud storage, creating distributed processing jobs for analytics dashboards and performance monitoring.
    </detail>
  </experience>

  <experience
    business="Topl"
    title="Blockchain Platform Engineer"
  >
    <start-date year="2021" month="3" />
    <end-date year="2022" month="5" />
    <detail>
      Core developer on proof-of-stake blockchain platform enabling supply chain verification and ethical business tracking through distributed ledger technology.
    </detail>
    <detail>
      Built distributed blockchain runtime using Akka actors with TCP networking and HTTP API for node management including transaction and staking key operations.
    </detail>
    <detail>
      Developed a transaction streaming client using Scala http4s, Cats Effect, MongoDB indexing, and Protobuf API, with React proof-of-concept UI demonstrating real-time transaction integration.
    </detail>
  </experience>

  <experience
    business="Viewpoint Construction Software"
    title="Software Engineer I &amp; II"
  >
    <start-date year="2019" month="9" />
    <end-date year="2021" month="4" />
    <detail>
      Full-stack engineer on a web application for construction project management, serving project managers, architects, and project leads with document tracking and workflow management.
    </detail>
    <detail>
      Developed a sophisticated change management system featuring event-sourced architecture, storing user interactions as immutable events with derived application state, integrating with enterprise resource management system.
    </detail>
    <detail>
      Delivered end-to-end features across technology stack including database models, C# .NET microservices APIs deployed on cloud infrastructure, and responsive web UI components.
    </detail>
    <detail>
      Worked with diverse data storage solutions including relational databases and specialized event stores for event sourcing implementation.
    </detail>
  </experience>

  <experience
    business="Viewpoint Construction Software"
    title="QA Automation Engineer"
  >
    <start-date year="2018" month="8" />
    <end-date year="2019" month="8" />
    <detail>
      Developed comprehensive test automation framework enabling non-technical QA team members to write API and UI tests using simplified C# interfaces.
    </detail>
    <detail>
      Built API testing framework for microservices validation and complex Selenium-based UI testing framework with XPath selectors supporting both headless and browser-based execution.
    </detail>
    <detail>
      Executed performance testing including bulk operations and load testing to ensure application responsiveness under high usage scenarios.
    </detail>
  </experience>

  <education
    school="University of Portland"
    degree="Bachelors of Science"
  >
    <start-date year="2015" month="8" />
    <end-date year="2019" month="5" />
    <detail>Computer Science Major</detail>
    <detail>Mathematics Minor</detail>
  </education>

  <certification name="AWS Cloud Practitioner"/>

  <skills group="Programming Languages">
    <skill>Scala</skill>
    <skill>Java</skill>
    <skill>C#</skill>
    <skill>Python</skill>
    <skill>JavaScript/TypeScript</skill>
  </skills>

  <skills group="Frontend Technologies">
    <skill>React</skill>
    <skill>HTML/CSS</skill>
    <skill>Modern UI/UX Patterns</skill>
    <skill>Component Libraries</skill>
  </skills>

  <skills group="Backend &amp; Infrastructure">
    <skill>Microservices Architecture</skill>
    <skill>API Development</skill>
    <skill>Event Sourcing</skill>
    <skill>Distributed Systems</skill>
    <skill>Multithreading &amp; Asynchronous Programming</skill>
  </skills>

  <skills group="Cloud &amp; DevOps">
    <skill>AWS (Kinesis, DynamoDB, S3, IAM)</skill>
    <skill>Azure</skill>
    <skill>CI/CD Pipelines</skill>
    <skill>Jenkins</skill>
    <skill>Github Actions</skill>
  </skills>

  <skills group="Data &amp; Analytics">
    <skill>Apache Spark</skill>
    <skill>Databricks</skill>
    <skill>Deltalake</skill>
    <skill>MongoDB</skill>
    <skill>MSSQL</skill>
    <skill>Event Store</skill>
  </skills>

</resume-content>
