<?xml version="1.0" encoding="UTF-8"?>

<!--
  Noonlight Senior Software Engineer Resume - Branden Vennes
  Tailored for emergency response APIs, full-stack development, and high-scale applications
-->
<resume-content
  xmlns="https://github.com/b-vennes/presume"
  xmlns:xsi="http://www.w3.org/2001/XMLSchema-instance"
  xsi:schemaLocation="https://github.com/b-vennes/presume cv-schema.xsd"
>

  <header
    name="Branden Vennes"
    email="b.n.vennes@gmail.com"
    github="b-vennes"
    site="www.brandenvennes.com"
  >
    <summary>
      Full-stack software engineer with 6+ years building high-scale distributed systems and real-time applications serving millions of users. Proven expertise developing REST APIs, streaming data platforms, and responsive web applications. Strong background in microservices architecture, database design, and contributing to engineering projects from conception to deployment. Passionate about leveraging technology to build socially impactful solutions.
    </summary>
  </header>

  <experience
    business="The Walt Disney Company"
    title="Software Engineer II"
  >
    <start-date year="2022" month="6" />
    <end-date year="2025" month="8" />

    <detail>
      Architected and maintained a high-throughput streaming data platform serving 50+ engineering teams, processing millions of real-time events with robust error handling and monitoring systems
    </detail>
    <detail>
      Developed comprehensive REST APIs and microservices architecture supporting Disney+ and Hulu content delivery, implementing sophisticated validation and compatibility checking systems
    </detail>
    <detail>
      Built state management systems enabling teams to maintain application state from event streams, successfully integrated into content metadata systems processing large-scale entertainment data
    </detail>
    <detail>
      Implemented multi-language code generation pipelines with automated JSON serialization, supporting development teams across multiple programming ecosystems including Python, Java, and Scala
    </detail>
    <detail>
      Designed complex CI/CD pipelines using Jenkins and GitHub Actions with automated testing, validation, and deployment processes ensuring reliable releases across distributed services
    </detail>
    <detail>
      Collaborated closely with product managers and architectural teams to identify potential technical barriers and deliver scalable solutions impacting millions of streaming users
    </detail>
  </experience>

  <experience
    business="Topl"
    title="Blockchain Platform Engineer"
  >
    <start-date year="2021" month="3" />
    <end-date year="2022" month="5" />
    <detail>
      Developed core runtime components for a distributed blockchain platform using Scala, implementing consensus algorithms and peer-to-peer networking protocols for supply chain verification applications
    </detail>
    <detail>
      Built a comprehensive HTTP management API enabling secure key rotation, transaction signing, and node configuration
    </detail>
    <detail>
      Architected a high-performance transaction streaming service with real-time querying capabilities, utilizing MongoDB for efficient data indexing and retrieval operations
    </detail>
    <detail>
      Developed a React user interface providing transaction monitoring and blockchain data visualization capabilities for supply chain tracking applications
    </detail>
    <detail>
      Mentored junior developers and took ownership of system components from initial design through production deployment and ongoing maintenance
    </detail>
  </experience>

  <experience
    business="Viewpoint Construction Software"
    title="Software Engineer I &amp; II"
  >
    <start-date year="2019" month="9" />
    <end-date year="2021" month="4" />
    <detail>
      Developed full-stack solutions for a construction project management platform serving thousands of users with complex organizational workflows and real-time collaboration features
    </detail>
    <detail>
      Architected an event-sourced change management system with complete audit trails, storing all user interactions as immutable events enabling reliable state reconstruction and compliance tracking
    </detail>
    <detail>
      Built sophisticated change order tracking with financial lineage and cross-entity referencing, integrated with enterprise resource management systems through REST API integrations
    </detail>
    <detail>
      Implemented a microservices architecture using C# deployed on Azure cloud infrastructure, spanning database design, API development, and responsive web user interfaces
    </detail>
    <detail>
      Collaborated with product teams to proactively identify technical challenges and delivered features that streamlined construction project workflows for thousands of active users
    </detail>
  </experience>

  <experience
    business="Viewpoint Construction Software"
    title="QA Automation Engineer"
  >
    <start-date year="2018" month="8" />
    <end-date year="2019" month="8" />
    <detail>
      Designed comprehensive test automation frameworks enabling non-technical team members to define complex test scenarios, significantly improving development team efficiency and code quality
    </detail>
    <detail>
      Built API testing frameworks for microservices validation and Selenium-based UI testing systems for automated browser testing, ensuring system reliability by catching regression bugs
    </detail>
    <detail>
      Conducted performance and load testing analysis including bulk operations to verify system scalability and responsiveness under high concurrent user scenarios
    </detail>
    <detail>
      Established quality assurance processes and comprehensive documentation reducing production defects and improving deployment reliability
    </detail>
  </experience>

  <education
    school="University of Portland"
    degree="Bachelors of Science"
  >
    <start-date year="2015" month="8" />
    <end-date year="2019" month="5" />
    <detail>Computer Science Major</detail>
    <detail>Mathematics Minor</detail>
  </education>

  <certification name="AWS Cloud Practitioner"/>

  <skills group="Programming &amp; Development">
    <skill>Scala</skill>
    <skill>Java</skill>
    <skill>C#</skill>
    <skill>Python</skill>
    <skill>JavaScript, TypeScript, and React</skill>
    <skill>SQL</skill>
  </skills>

  <skills group="Backend &amp; Infrastructure">
    <skill>REST API Design</skill>
    <skill>Microservices Architecture</skill>
    <skill>Real-time Data Processing</skill>
    <skill>AWS Cloud Services</skill>
    <skill>Azure Platform</skill>
    <skill>MongoDB</skill>
    <skill>PostgreSQL</skill>
  </skills>

  <skills group="Development &amp; Collaboration">
    <skill>Event-driven Systems</skill>
    <skill>CI/CD Pipeline Design</skill>
    <skill>Database Design</skill>
    <skill>Team Mentoring</skill>
    <skill>Cross-functional Collaboration</skill>
    <skill>Performance Optimization</skill>
  </skills>

</resume-content>
